,N,NO ESBL CONFIRMATION,2016,Rwanda Medical Journal,Rogo,High incidence of bacteria resistant to who recommended empiric antibiotics for neonatal sepsis at a tertiary level neonatology unit in Rwanda,Rwanda,,Kigali,cross_sec_survey,2013,2013,invasive,"neonatal sepsis, positive culture",sequential,human,IP,no,neonates,invasive,"blood, csf, urine",NA,NA,NA,,,,,,,,,,,,,,,,,,,,,,,,,,,,,,,,,,,,,,,,,,,,,,,,,,,,,,,,,,,,,,,,,,,
,N,ESBL confirmation not described,2014,Paediatr Int Child Health,Morkel,Bloodstream infections and antimicrobial resistance patterns in a South African neonatal intensive care unit,South Africa,,Cape town,cross_sec_survey,2008,2008,invasive,NICU admissions,sequential,human,IP,both,children,invasive,blood,,NA,,,,,,,,,,,,,,,,,,,,,,,,,,,,,,,,,,,,,,,,,,,,,,,,,,,,,,,,,,,,,,,,,,,,
,N,no speciation or ESBL confirmation,2018,"APMIS : acta pathologica, microbiologica, et immunologica Scandinavica",Nestor,"Detection of extended-spectrum beta-lactamase production in Enterobacteriales from patients with suspected urinary tract infections, Tabora region, Rural Tanzania",Tanzania,Tabora,,cross_sec_survey,2016,2016,invasive,sequential_urines_in_lab,sequential,human,IP_and_OP,,adults,invasive,urine,NA,,,,,,,,,,,,,,,,,,,,,,,,,,,,,,,,,,,,,,,,,,,,,,,,,,,,,,,,,,,,,,,,,,,,,
,N,cant extract ESCO/klpn ESBL,2017,lancet id,musicha,Trends in antimicrobial resistance in bloodstream infection isolates at a large urban hospital in Malawi (1998-2016): a surveillance study,Malawi,,Blantyre,cross_sec_survey,1998,2016,invasive,fever,sequential,human,IP_and_OP,,both,invasive,blood,NA,API,combination_disc,1,,,,,,,,,,,,,,,,,,,,,,,,,,,,,,,,,,,,,,,,,,,,,,,,,,,,,,,,,,,,,,,,,,
,N,can't disaggregate  ESBL,2017,Pan African Medical Journal,Kengne,"Bacteriological profile and antimicrobial susceptibility patterns of urine culture isolates from patients in Ndjamena, Chad",Chad,,Ndjamena,cross_sec_survey,2014,2014,invasive,UTI,sequential,human,IP_and_OP,,both,invasive,,,,,,,,,,,,,,,,,,,,,,,,,,,,,,,,,,,,,,,,,,,,,,,,,,,,,,,,,,,,,,,,,,,,,,,
,N,NO ESBL CONFIRMATION,2016,Annals of Clinical Microbiology and Antimicrobials,Obeng-Nkrumah,Trends in paediatric and adult bloodstream infections at a Ghanaian referral hospital: A retrospective study,Ghana,,Kole-buu,cross_sec_survey,2010,2014,invasive,suspected sepsis,sequential,human,IP_and_OP,unknown,> 28 days,invasive,blood,NA,,,,,,,,,,,,,,,,,,,,,,,,,,,,,,,,,,,,,,,,,,,,,,,,,,,,,,,,,,,,,,,,,,,,,
,N,no esbl CONFIRMATION,2015,East Afr Med J,Magale,"ANTIBIOTIC SUSCEPTIBILITY OF ORGANISMS CAUSING URINARY TRACT INFECTION IN PATIENTS PRESENTING AT KENYATTA NATIONAL HOSPITAL, NAIROBI",kenya,,nairobi,cross_sec_survey,2013,2013,invasive,suspected uti,sequential,human,IP_and_OP,both,both,invasive,urine,chromagar,NA,NA,,,,,,,,,,,,,,,,,,,,,,,,,,,,,,,,,,,,,,,,,,,,,,,,,,,,,,,,,,,,,,,,,,,
,N,no esbl CONFIRMATION,2015,plos one,seboxa,"High mortality from blood stream infection in Addis Ababa, Ethiopia, is due to antimicrobial resistance",Ethiopia,,addis ababa,cross_sec_survey,2012,2013,invasive,sepsis,sequential,human,on_hospital_admission,,,,,,,,,,,,,,,,,,,,,,,,,,,,,,,,,,,,,,,,,,,,,,,,,,,,,,,,,,,,,,,,,,,,,,,,,,
,N,NO ESBL CONFIRMATION,2017,Open Microbiology Journal,Oli,"Bacteriology and antibiogram of urinary tract infection among female patients in a tertiary health facility in South Eastern Nigeria	",Nigeria,,Awka,cross_sec_survey,2016,2016,invasive,women_uti,sequential,human,OP,,adults,invasive,urine,,,,,,,,,,,,,,,,,,,,,,,,,,,,,,,,,,,,,,,,,,,,,,,,,,,,,,,,,,,,,,,,,,,,,,
,N,CTXM only,2018,Eur J Clin Microbiol Infect Dis,Sonda,"Prevalence and risk factors for CTX-M gram-negative bacteria in hospitalized patients at a tertiary care hospital in Kilimanjaro, Tanzania European journal of clinical microbiology & infectious diseases : official publication of the European Society of Clinical Microbiology",Tanzania,Kilimanjaro,,cross_sec_survey,2013,2015,invasive,,,,,,,,,,,,,,,,,,,,,,,,,,,,,,,,,,,,,,,,,,,,,,,,,,,,,,,,,,,,,,,,,,,,,,,,,,,,,,
,N,NO ESBL CONFIRMATION,2016,BMC Infectious Diseases,Moremi,Antimicrobial resistance pattern: A report of microbiological cultures at a tertiary hospital in Tanzania,Tanzania,,Mwanza,cross_sec_survey,2013,2015,invasive,,,,,,,,,,,,,,,,,,,,,,,,,,,,,,,,,,,,,,,,,,,,,,,,,,,,,,,,,,,,,,,,,,,,,,,,,,,,,,
,N,no esbl CONFIRMATION,2015,Br Microbiol Res J,Ampaire,Epidemiology of Carbapenem Resistance among Multi-drug Resistant Enterobacteriaceae in Uganda,Uganda,,Mbarara,cross_sec_survey,2013,2014,invasive,,,,,,,,,,,,,,,,,,,,,,,,,,,,,,,,,,,,,,,,,,,,,,,,,,,,,,,,,,,,,,,,,,,,,,,,,,,,,,
,N,no esbl CONFIRMATION,2015,"Ital J Pediatr	",Ahmed,"Multi-resistant gram negative enteric bacteria causing urinary tract infection among malnourished underfives admitted at a tertiary hospital, northwestern, Tanzania",Tanzania,,Mwanza,cross_sec_survey,2012,2013,invasive,,,,,,,,,,,,,,,,,,,,,,,,,,,,,,,,,,,,,,,,,,,,,,,,,,,,,,,,,,,,,,,,,,,,,,,,,,,,,,
,N,can't disaggregate ESBL species,2006,Journal of Antimicrobial Chemotherapy,Gray,Identification and characterization of ceftriaxone resistance and extended-spectrum β-lactamases in Malawian bacteraemic Enterobacteriaceae,Malawi,,Blantyre,cross_sec_survey,2004,2006,invasive,enterobacteriaecia_in_lab,,,,,,,,,,,,,,,,,,,,,,,,,,,,,,,,,,,,,,,,,,,,,,,,,,,,,,,,,,,,,,,,,,,,,,,,,,,,,
,N,PCR only for some ESBLS,2018,Tropical Animal Health and Production,Messele,Analysis of milk-derived isolates of E. coli indicating drug resistance in central Ethiopia,Ethiopia,,,cross_sec_survey,,,,,,,,,,,,,,,,,,,,,,,,,,,,,,,,,,,,,,,,,,,,,,,,,,,,,,,,,,,,,,,,,,,,,,,,,,,,,,,,,
,N,can't disaggregate  ESBL,2018,Journal of Obstetrics and Gynaecology,Majangara,Microbiology and clinical outcomes of puerperal sepsis: a prospective cohort study,,,,,,,,,,,,,,,,,,,,,,,,,,,,,,,,,,,,,,,,,,,,,,,,,,,,,,,,,,,,,,,,,,,,,,,,,,,,,,,,,,,,,
,N,ESBL producers only,2018,Med Mal Infect,Kpoda,"Presence of qnr genes in ESBL-producing Enterobacteriaceae strains resistant to quinolones in Ouagadougou, Burkina Faso",,,,,,,,,,,,,,,,,,,,,,,,,,,,,,,,,,,,,,,,,,,,,,,,,,,,,,,,,,,,,,,,,,,,,,,,,,,,,,,,,,,,,
,N,can't disaggregate  ,2018,Nature Microbiology,Ingle,,,,,,,,,,,,,,,,,,,,,,,,,,,,,,,,,,,,,,,,,,,,,,,,,,,,,,,,,,,,,,,,,,,,,,,,,,,,,,,,,,,,,,
,N,NoESBL confirmation,2018,International Journal of Environmental Research and Public Health, Igwaran,Molecular Characterization and Antimicrobial Resistance Pattern of Escherichia coli Recovered from Wastewater Treatment Plants in Eastern Cape South Africa,South Africa,Eastern Cape,,cross_sec_survey,,,,,,,,,,,,,,,,,,,,,,,,,,,,,,,,,,,,,,,,,,,,,,,,,,,,,,,,,,,,,,,,,,,,,,,,,,,,,,,,,
,N,Pooled samples - can't disaggregate,2018,Frontiers in microbiology,Founou,Genome Sequencing of Extended-Spectrum beta-Lactamase (ESBL)-Producing Klebsiella pneumoniae Isolated from Pigs and Abattoir Workers in Cameroon,Cameroon and south Africa,,,cross_sec_survey,,,,,,,,,,,,,,,,,,,,,,,,,,,,,,,,,,,,,,,,,,,,,,,,,,,,,,,,,,,,,,,,,,,,,,,,,,,,,,,,,
,N,Inclusion criteria not given,2018,Russian Journal of Infection and Immunity,Egorova,Antimicrobial susceptibility of enterobacteriacae isolated from intestinal microbiota of residents of the Republic of Guinea and Russia,,,,,,,,,,,,,,,,,,,,,,,,,,,,,,,,,,,,,,,,,,,,,,,,,,,,,,,,,,,,,,,,,,,,,,,,,,,,,,,,,,,,,
,N,no esbl CONFIRMATION,2018,BMC Research Notes,Belachew,"High level of drug resistance by gram-negative bacteria from selected sewage polluted urban rivers in Addis Ababa, Ethiopia",Ethiopia,,Addis abbaba,cross_sec_survey,,,,,,,,,,,,,,,,,,,,,,,,,,,,,,,,,,,,,,,,,,,,,,,,,,,,,,,,,,,,,,,,,,,,,,,,,,,,,,,,,
,N,no esbl CONFIRMATION,2018,Antimicrobial Resistance and Infection Control,Agyebong,"Multidrug-resistant gram-negative bacterial infections in a teaching hospital in Ghana	",,,,cross_sec_survey,,,,,,,,,,,,,,,,,,,,,,,,,,,,,,,,,,,,,,,,,,,,,,,,,,,,,,,,,,,,,,,,,,,,,,,,,,,,,,,,,
,N,ESBL producers only,2018,Environ Sci Pollut Res Int,Adelowo,,Nigeria,,,cross_sec_survey,,,,,,,,,,,,,,,,,,,,,,,,,,,,,,,,,,,,,,,,,,,,,,,,,,,,,,,,,,,,,,,,,,,,,,,,,,,,,,,,,
,N,NO ESBL CONFIRMATION,2018,Antibiotics,Abia,Where did they come from—Multi-drug resistant pathogenic Escherichia coli in a cemetery environment?,,,,cross_sec_survey,,,,,,,,,,,,,,,,,,,,,,,,,,,,,,,,,,,,,,,,,,,,,,,,,,,,,,,,,,,,,,,,,,,,,,,,,,,,,,,,,
,N,NO ESBL CONFIRMATION,2018,"International Journal of Microbiology	",Alfadil,Characterization of pathogenic bacteria isolated from sudanese banknotes and determination of their resistance profile,Sudan,,,cross_sec_survey,,,,,,,,,,,,,,,,,,,,,,,,,,,,,,,,,,,,,,,,,,,,,,,,,,,,,,,,,,,,,,,,,,,,,,,,,,,,,,,,,
,N,Kleb_only_and_carriage_study,2017,plos one,Taitt,Antimicrobial resistance of Klebsiella pneumoniae stool isolates circulating in Kenya,Kenya,multiple,,cross_sec_survey,,,,,,,,,,,,,,,,,,,,,,,,,,,,,,,,,,,,,,,,,,,,,,,,,,,,,,,,,,,,,,,,,,,,,,,,,,,,,,,,,
,N,non english,2017,"		Med Sante Trop",Sangare,Prevalence of extended-spectrum beta-lactamase phenotypes in enterobacteria isolated from blood cultures of patients at admission to the University Hospital of Bamako,,,,,,,,,,,,,,,,,,,,,,,,,,,,,,,,,,,,,,,,,,,,,,,,,,,,,,,,,,,,,,,,,,,,,,,,,,,,,,,,,,,,,
,N,non english,2017,Pan Afr Med J,Rakotovao-Ravahatra,"	[Resistant phenotypes of Escherichia coli strains responsible for urinary tract infection in the laboratory of the University Hospital Joseph Raseta Befelatanana, Antananarivo]",,,,,,,,,,,,,,,,,,,,,,,,,,,,,,,,,,,,,,,,,,,,,,,,,,,,,,,,,,,,,,,,,,,,,,,,,,,,,,,,,,,,,
,N,source of samples not clear,2017,"International Dairy Journal	",Ntuli,"Extended-spectrum β-lactamase, shigatoxin and haemolysis capacity of O157 and non-O157 E. coli serotypes from producer-distributor bulk milk",,,,,,,,,,,,,,,,,,,,,,,,,,,,,,,,,,,,,,,,,,,,,,,,,,,,,,,,,,,,,,,,,,,,,,,,,,,,,,,,,,,,,
,N,sample selection not clear,2017,JAC,musicha,Genomic landscape of extended-spectrum beta-lactamase resistance in Escherichia coli from an urban African setting,Malawi,,,,,,,,,,,,,,,,,,,,,,,,,,,,,,,,,,,,,,,,,,,,,,,,,,,,,,,,,,,,,,,,,,,,,,,,,,,,,,,,,,,,
,N,< 10 enterbacteriaeciae,2017,Journal of Biological Sciences,mthembu,"Antibiotic susceptibility patterns of bacteria recovered from wounds of diabetic patients in some Northern Kwazulu-Natal Hospitals, South Africa	",South Africa,KZN,,cross_sec_survey,,,,,,,,,,,,,,,,,,,,,,,,,,,,,,,,,,,,,,,,,,,,,,,,,,,,,,,,,,,,,,,,,,,,,,,,,,,,,,,,,
,N,selection of isolates for AST not clear,2017,Eur J Microbiol Immunol,Konate,"Epidemiology and Antibiotic Resistance Phenotypes of Diarrheagenic Escherichia Coli Responsible for Infantile Gastroenteritis in Ouagadougou, Burkina Faso	",Burkina Faso,,Ouagadoudou,cross_sec_survey,2013,2015,,,,,,,,,,,,,,,,,,,,,,,,,,,,,,,,,,,,,,,,,,,,,,,,,,,,,,,,,,,,,,,,,,,,,,,,,,,,,,,
,N,NO ESBL CONFIRMATION,2017,Asian Pacific Journal of Tropical Disease,Iwu,"Antibiotic resistance profiles of Escherichia coli O26, O145, and O157:H7 isolated from swine in the Eastern Cape Province, South Africa",South Africa,Eastern Cape,,cross_sec_survey,,,,,,,,,,,,,,,,,,,,,,,,,,,,,,,,,,,,,,,,,,,,,,,,,,,,,,,,,,,,,,,,,,,,,,,,,,,,,,,,,
,N,can't disaggregate ESBL- but interesting efect of TMPon CTX resistance!,2017,African Journal of Infectious Diseases,Egwuatu,Effect of trimethoprim-sulfamethoxazole prophylaxis on feacal carriage rates of resistant isolates of Escherichia coli in HIV-infected adult patients in lagos,Nigeria,,Lagos,cross_sec_survey,2009,2009,,,,,,,,,,,,,,,,,,,,,,,,,,,,,,,,,,,,,,,,,,,,,,,,,,,,,,,,,,,,,,,,,,,,,,,,,,,,,,,
,N,No ESBL confirmation,2017,"International Journal of Microbiology	",Duedu,Multidrug Resistant Enteric Bacterial Pathogens in a Psychiatric Hospital in Ghana: Implications for Control of Nosocomial Infections,Ghana,,Accra,cross_sec_survey,,,,,,,,,,,,,,,,,,,,,,,,,,,,,,,,,,,,,,,,,,,,,,,,,,,,,,,,,,,,,,,,,,,,,,,,,,,,,,,,,
,N,Carriage isolates but no denominator,2017,S Afr Med J,DeFrancesco,"Antibiotic resistance patterns and beta-lactamase identification in Escherichia coli isolated from young children in rural Limpopo Province, South Africa: The MAL-ED cohort",,,,,,,,,,,,,,,,,,,,,,,,,,,,,,,,,,,,,,,,,,,,,,,,,,,,,,,,,,,,,,,,,,,,,,,,,,,,,,,,,,,,,
,N,No esBL CONFIRMATION,2017,African Journal of Urology,Barry,"Antimicrobial susceptibility profile of community-acquired urinary tract infection in adults: A seven months prospective cross-sectional study in Dakar Town, Senegal",Senegal,,Dakar,cross_sec_survey,,,,,,,,,,,,,,,,,,,,,,,,,,,,,,,,,,,,,,,,,,,,,,,,,,,,,,,,,,,,,,,,,,,,,,,,,,,,,,,,,
,N,< 10 enterbacteriaeciae,2017,BMC Res Notes,Agaba,Nosocomial bacterial infections and their antimicrobial susceptibility patterns among patients in Ugandan intensive care units: a cross sectional study,Uganda,,multiple,cross_sec_survey,,,,,,,,yes,,,,,,,,,,,,,,,,,,,,,,,,,,,,,,,,,,,,,,,,,,,,,,,,,,,,,,,,,,,,,,,,,,,,,,,,,
,N,no esbl CONFIRMATION,2016,Front Microbiol,Seidman,Longitudinal comparison of antibiotic resistance in diarrheagenic and non-pathogenic escherichia coli from young tanzanian children,tanzania,,,,,,,,,,,,,,,,,,,,,,,,,,,,,,,,,,,,,,,,,,,,,,,,,,,,,,,,,,,,,,,,,,,,,,,,,,,,,,,,,,,,
,N,carriage but in urine - not clear if is invasive or carriage,2016,J Pharm Bioallied Sci,Onanuga ,"Virulence and antimicrobial resistance of common urinary bacteria from asymptomatic students of Niger Delta University, Amassoma, Bayelsa State, Nigeria",Nigeria,,,,,,,,,,,,,,,,,,,,,,,,,,,,,,,,,,,,,,,,,,,,,,,,,,,,,,,,,,,,,,,,,,,,,,,,,,,,,,,,,,,,
,N,no denominator,2016,Vet Microbiol,Ojo,Detection and characterization of extended-spectrum beta-lactamase-producing Escherichia coli from chicken production chains in Nigeria,Nigeria,,,,,,,,,,,,,,,,,,,,,,,,,,,,,,,,,,,,,,,,,,,,,,,,,,,,,,,,,,,,,,,,,,,,,,,,,,,,,,,,,,,,
,N,can't disaggregate  ESBL,2016,BMC Microbiology,Lyimo,Comparison of antibiotic resistant Escherichia coli obtained from drinking water sources in northern Tanzania: a cross-sectional study,Tanzania,,,,,,,,,,,,,,,,,,,,,,,,,,,,,,,,,,,,,,,,,,,,,,,,,,,,,,,,,,,,,,,,,,,,,,,,,,,,,,,,,,,,
,N,NO ESBL CONFIRMATION,2016,American Journal of Tropical Medicine and Hygiene,Carroll,"Five-year antimicrobial susceptibility trends among bacterial isolates from a tertiary health-care facility in Kigali, Rwanda",rwanda,,,,,,,,,,,,,,,,,,,,,,,,,,,,,,,,,,,,,,,,,,,,,,,,,,,,,,,,,,,,,,,,,,,,,,,,,,,,,,,,,,,,
,N,NO ESBL CONFIRMATION,2016,Biomed Res Int,Adesoji,Detection of Extended Spectrum Beta-Lactamases Resistance Genes among Bacteria Isolated from Selected Drinking Water Distribution Channels in Southwestern Nigeria,Nigeria,,,,,,,,,,,,,,,,,,,,,,,,,,,,,,,,,,,,,,,,,,,,,,,,,,,,,,,,,,,,,,,,,,,,,,,,,,,,,,,,,,,,
,N,NO ESBL CONFIRMATION,2016,Journal of Infection in Developing Countries,Adenipekun,"Prevalence and multidrug resistance of Escherichia coli from community-acquired infections in Lagos, Nigeri",,,,,,,,,,,,,,,,,,,,,,,,,,,,,,,,,,,,,,,,,,,,,,,,,,,,,,,,,,,,,,,,,,,,,,,,,,,,,,,,,,,,,
,N,no esbl CONFIRMATION,2015,Science of the Total Environment,Titilawo,"Antimicrobial resistance determinants of Escherichia coli isolates recovered from some rivers in Osun State, South-Western Nigeria: Implications for public health		",,,,,,,,,,,,,,,,,,,,,,,,,,,,,,,,,,,,,,,,,,,,,,,,,,,,,,,,,,,,,,,,,,,,,,,,,,,,,,,,,,,,,
,N,can't disaggregate ESBL  ,2015,South African Medical Journal, Preziosi,A prospective observational study of bacteraemia in adults admitted to an urban Mozambican hospital,Mozambique,,,,,,,,,,,,,,,,,,,,,,,,,,,,,,,,,,,,,,,,,,,,,,,,,,,,,,,,,,,,,,,,,,,,,,,,,,,,,,,,,,,,
,N,no esbl CONFIRMATION,2015,"American Journal of Tropical Medicine and Hygiene			92	",Ntirenganya,High prevalence of antimicrobial resistance among common bacterial isolates in a tertiary healthcare facility in Rwanda,,,,cross_sec_survey,,,,,,,,,,,,,,,,,,,,,,,,,,,,,,,,,,,,,,,,,,,,,,,,,,,,,,,,,,,,,,,,,,,,,,,,,,,,,,,,,
,N,no esbl CONFIRMATION,2015,Journal of Pharmacy and Pharmaceutical Sciences,Mwambete,Antimicrobial resistance profiles of bacteria isolated from chicken droppings in Dar es Salaam,Tanzania,,Dar es salaam,cross_sec_survey,,,,,,,,,,,,,,,,,,,,,,,,,,,,,,,,,,,,,,,,,,,,,,,,,,,,,,,,,,,,,,,,,,,,,,,,,,,,,,,,,
,N,cant extract denominator,2015,Biomed Res Int,Mousse,Identification of Extended-Spectrum beta-Lactamases Escherichia coli Strains Isolated from Market Garden Products and Irrigation Water in Benin,Benin,,,,,,,,,,,,,,,,,,,,,,,,,,,,,,,,,,,,,,,,,,,,,,,,,,,,,,,,,,,,,,,,,,,,,,,,,,,,,,,,,,,,
,N,can't disaggregate  ESBL,2015,"AIDS Research and Treatment	",Marwa,"Resistance to cotrimoxazole and other antimicrobials among isolates from HIV/AIDS and Non-HIV/AIDS patients at bugando medical centre, Mwanza, Tanzania",,,,,,,,,,,,,,,,,,,,,,,,,,,,,,,,,,,,,,,,,,,,,,,,,,,,,,,,,,,,,,,,,,,,,,,,,,,,,,,,,,,,,
,N,EPEC,2015,plos one,Langendorf,Enteric bacterial pathogens in children with diarrhea in Niger: diversity and antimicrobial resistance,Niger,,,,,,,,,,,,,,,,,,,,,,,,,,,,,,,,,,,,,,,,,,,,,,,,,,,,,,,,,,,,,,,,,,,,,,,,,,,,,,,,,,,,
,N,no esbl CONFIRMATION,2014,International Journal of Pharmacy and Pharmaceutical Sciences,Mwambete,"Antibiotic resistance profiles of bacterial pathogens from private hospitals in dar es salaam, Tanzania	",Tanzania,,Dar es salaam,cross_sec_survey,,,,,,,,,,,,,,,,,,,,,,,,,,,,,,,,,,,,,,,,,,,,,,,,,,,,,,,,,,,,,,,,,,,,,,,,,,,,,,,,,
,N,can't disaggregate  ,2014,British microbiology research journal,Moses,Prevalence and Genotypic Characterization of Extended-Spectrum Beta-Lactamases Produced by Gram Negative Bacilli at a Tertiary Care Hospital in Rural South Western Uganda,Uganda,Mbarara,,cross_sec_survey,2012,2012,,,,,,,,,,,,,,,,,,,,,,,,,,,,,,,,,,,,,,,,,,,,,,,,,,,,,,,,,,,,,,,,,,,,,,,,,,,,,,,
,N,NO ESBL CONFIRMATION,2014,BMC Res Notes,Manyahi,"Predominance of multi-drug resistant bacterial pathogens causing surgical site infections in Muhimbili National Hospital, Tanzania",Tanzania,,,,,,,,,,,,,,,,,,,,,,,,,,,,,,,,,,,,,,,,,,,,,,,,,,,,,,,,,,,,,,,,,,,,,,,,,,,,,,,,,,,,
,N,can't diaggregate animals vs environment,2014,plos one,Ikegbunam,Abattoirs as non-hospital source of extended spectrum beta lactamase producers: confirmed by the double disc synergy test and characterized by matrix-assisted laser desorption/ionization time of flight mass spectrometry,,,,,,,,,,,,,,,,,,,,,,,,,,,,,,,,,,,,,,,,,,,,,,,,,,,,,,,,,,,,,,,,,,,,,,,,,,,,,,,,,,,,,
,N,source of samples not clear,2013,J Infect Dev Ctries,Ogbolu,Dissemination of IncF plasmids carrying beta-lactamase genes in Gram-negative bacteria from Nigerian hospitals,Nigeria,,various,cross_sec_survey,,,,,,,,,,,,,,,,,,,,,,,,,,,,,,,,,,,,,,,,,,,,,,,,,,,,,,,,,,,,,,,,,,,,,,,,,,,,,,,,,
,N,NO ESBL CONFIRMATION,2013,S Afr Med J,Lewis,"Antimicrobial susceptibility of organisms causing community-acquired urinary tract infections in Gauteng Province, South Africa",South Africa,,Gauteng,,,,,,,,,,,,,,,,,,,,,,,,,,,,,,,,,,,,,,,,,,,,,,,,,,,,,,,,,,,,,,,,,,,,,,,,,,,,,,,,,,
,N,NO ESBL CONFIRMATION,2013,Ethiopian Journal of Health Development,Kabew,"A retrospective study on prevalence and antimicrobial susceptibility patterns of bacterial isolates from urinary tract infections in Tikur Anbessa Specialized Teaching Hospital Addis Ababa, Ethiopia",Ethiopia,,Addis ababa,,,,,,,,,,,,,,,,,,,,,,,,,,,,,,,,,,,,,,,,,,,,,,,,,,,,,,,,,,,,,,,,,,,,,,,,,,,,,,,,,,
,N,cant disaggregate carriage and invasive,2012,"East Afr J Public Health	",Mulualem,"Occurrence of extended spectrum beta (b)-lactamases in multi-drug resistant Escherichia coli isolated from a clinical setting in Jimma University Specialized Hospital, Jimma, southwest Ethiopia",Ethiopia,Jimma,,,,,,,,,,,,,,,,,,,,,,,,,,,,,,,,,,,,,,,,,,,,,,,,,,,,,,,,,,,,,,,,,,,,,,,,,,,,,,,,,,,
,N,cant disaggregate carriage and invasive,2012,BMC Microbiology,Kiiru,Analysis of -lactamase phenotypes and carriage of selected -lactamase genes among Escherichia coli strains obtained from Kenyan patients during an 18-year period,Kenya,,,,,,,,,,,,,,,,,,,,,,,,,,,,,,,,,,,,,,,,,,,,,,,,,,,,,,,,,,,,,,,,,,,,,,,,,,,,,,,,,,,,
,N,can't extract ESBL %,2012,African health sciences,Ibrahim,"Increased multi-drug resistant Escherichia coli from hospitals in Khartoum state, Sudan",Sudan,,Khartoum,,,,,,,,,,,,,,,,,,,,,,,,,,,,,,,,,,,,,,,,,,,,,,,,,,,,,,,,,,,,,,,,,,,,,,,,,,,,,,,,,,
,N,can't extract ESBL %,2012,Eur J Clin Microbiol Infect Dis,De Boeck,"Presence of extended-spectrum beta-lactamase-producing Enterobacteriaceae in waste waters, Kinshasa, the Democratic Republic of the Congo	",democratic republic of congo,,Kinshasa,cross_sec_survey,,,,,,,,,,,,,,,,,,,,,,,,,,,,,,,,,,,,,,,,,,,,,,,,,,,,,,,,,,,,,,,,,,,,,,,,,,,,,,,,,
,N,no ESBL CONFIRMATION,2012,ISRN pediatrics,Ballot,"Bacterial bloodstream infections in neonates in a developing country	",,,,,,,,,,,,,,,,,,,,,,,,,,,,,,,,,,,,,,,,,,,,,,,,,,,,,,,,,,,,,,,,,,,,,,,,,,,,,,,,,,,,,
,N,can't disaggregate  ESBL species,2011,Am J Trop Med Hyg,Muvunyi,Decreased susceptibility to commonly used antimicrobial agents in bacterial pathogens isolated from urinary tract infections in Rwanda: need for new antimicrobial guidelines,Rwanda,,,,,,,,,,,,,,,,,,,,,,,,,,,,,,,,,,,,,,,,,,,,,,,,,,,,,,,,,,,,,,,,,,,,,,,,,,,,,,,,,,,,
,N,no esbl CONFIRMATION,2011,African Health Sciences,Kibret,Antimicrobial susceptibility patterns of E. coli from clinical sources in northeast Ethiopia,,,,,,,,,,,,,,,,,,,,,,,,,,,,,,,,,,,,,,,,,,,,,,,,,,,,,,,,,,,,,,,,,,,,,,,,,,,,,,,,,,,,,
,N,can't extract ESBL %,2011,J Antimicrob Chemother,Fortini,Plasmid-mediated quinolone resistance and beta-lactamases in Escherichia coli from healthy animals from Nigeria,Nigeria,,,,,,,,,,,,,,,,,,,,,,,,,,,,,,,,,,,,,,,,,,,,,,,,,,,,,,,,,,,,,,,,,,,,,,,,,,,,,,,,,,,,
,N,can't extract ESBL %,2011,Bosnian journal of basic medical sciences,Afunwa,Antimicrobial resistance status and prevalence rates of extended spectrum beta-lactamase (ESBL) producers isolated from a mixed human population,Nigeria,,,,,,,,,,,,,,,,,,,,,,,,,,,,,,,,,,,,,,,,,,,,,,,,,,,,,,,,,,,,,,,,,,,,,,,,,,,,,,,,,,,,
,N,not clear if colonisation or infection,2011,African Journal of Pharmacy and Pharmacology,Adegoke,"Prevalence, antibiotic susceptibility profile and extended spectrum β-lactamase production among escherichia coli from high vaginal swab (HVS)",,,,,,,,,,,,,,,,,,,,,,,,,,,,,,,,,,,,,,,,,,,,,,,,,,,,,,,,,,,,,,,,,,,,,,,,,,,,,,,,,,,,,
,N,can't disaggregate  ESBL species,2010,Journal of Infection in Developing Countries,Randrianirina,"Antimicrobial resistance in pathogens causing nosocomial infections in surgery and intensive care wards in Antananarivo, Madagascar	",Madagascar,,,,,,,,,,,,,,,,,,,,,,,,,,,,,,,,,,,,,,,,,,,,,,,,,,,,,,,,,,,,,,,,,,,,,,,,,,,,,,,,,,,,
,N,NO ESBL CONFIRMATION,2010,Tanzan J Health Res,Moyo,Bacterial isolates and drug susceptibility patterns of urinary tract infection among pregnant women at Muhimbili National Hospital in Tanzania,Tanzania,,,,,,,,,,,,,,,,,,,,,,,,,,,,,,,,,,,,,,,,,,,,,,,,,,,,,,,,,,,,,,,,,,,,,,,,,,,,,,,,,,,,
,N,case series,2010,South African medical journal,Moyo,"Bacteria isolated from bloodstream infections at a tertiary hospital in Dar es Salaam, Tanzania--antimicrobial resistance of isolates",Tanzania,,Dar es salaam,,,,,,,,,,,,,,,,,,,,,,,,,,,,,,,,,,,,,,,,,,,,,,,,,,,,,,,,,,,,,,,,,,,,,,,,,,,,,,,,,,
,N,NO ESBL CONFIRMATION,2010,American Journal of Tropical Medicine and Hygiene,Mandomando,"Antimicrobial drug resistance trends of bacteremia isolates in a rural hospital in southern Mozambique	",MOzambique,,,,,,,,,,,,,,,,,,,,,,,,,,,,,,,,,,,,,,,,,,,,,,,,,,,,,,,,,,,,,,,,,,,,,,,,,,,,,,,,,,,,
,N,NO ESBL CONFIRMATION,2010,East African medical journal,Kohli,"Antibacterial susceptibility patterns of blood stream isolates in patients investigated at the Aga Khan University Hospital, Nairobi",Kenya,,Nairobi,,,,,,,,,,,,,,,,,,,,,,,,,,,,,,,,,,,,,,,,,,,,,,,,,,,,,,,,,,,,,,,,,,,,,,,,,,,,,,,,,,
,N,NO ESBL CONFIRMATION,2008,World Journal of Microbiology and Biotechnology,Taiwo,High antimicrobial resistance among bacterial isolates of blood stream infections (BSI) in a Nigerian University Teaching Hospital,Nigeria,,,,,,,,,,,,,,,,,,,,,,,,,,,,,,,,,,,,,,,,,,,,,,,,,,,,,,,,,,,,,,,,,,,,,,,,,,,,,,,,,,,,
,N,NO ESBL CONFIRMATION,2008,Journal of Antimicrobial Chemotherapy,Djie-Maletz,High rate of resistance to locally used antibiotics among enteric bacteria from children in Northern Ghana,,,,,,,,,,,,,,,,,,,,,,,,,,,,,,,,,,,,,,,,,,,,,,,,,,,,,,,,,,,,,,,,,,,,,,,,,,,,,,,,,,,,,
,N,can't disaggregate  ESBL species,2008,BMC Infect Dis,Cotton,"High incidence of antimicrobial resistant organisms including extended spectrum beta-lactamase producing Enterobacteriaceae and methicillin-resistant Staphylococcus aureus in nasopharyngeal and blood isolates of HIV-infected children from Cape Town, South Africa",,,,,,,,,,,,,,,,,,,,,,,,,,,,,,,,,,,,,,,,,,,,,,,,,,,,,,,,,,,,,,,,,,,,,,,,,,,,,,,,,,,,,
,N,nonenglish,2007,Medecine et Maladies Infectieuses,Ahoyo,"Incidence of infections due to Escherichia coli strains producing extended spectrum betalactamase, in the Zou/Collines Hospital Centre (CHDZ/C) in Benin",Benin,,,,,,,,,,,,,,,,,,,,,,,,,,,,,,,,,,,,,,,,,,,,,,,,,,,,,,,,,,,,,,,,,,,,,,,,,,,,,,,,,,,,
,N,can't disaggregate ESBL species,2006,Emerging infectious diseases,Frank,"Extended-spectrum beta-lactamase-producing Enterobacteriaceae, Central African Republic",,,,,,,,,,,,,,,,,,,,,,,,,,,,,,,,,,,,,,,,,,,,,,,,,,,,,,,,,,,,,,,,,,,,,,,,,,,,,,,,,,,,,
,N,selection of klebsiella isolates not clear,2005,Acta Trop,Seid,"Occurrence of extended spectrum beta-lactamase enzymes in clinical isolates of Klebsiella species from Harar region, eastern Ethiopia",Ethiopia,,,,,,,,,,,,,,,,,,,,,,,,,,,,,,,,,,,,,,,,,,,,,,,,,,,,,,,,,,,,,,,,,,,,,,,,,,,,,,,,,,,,
,N,NO ESBL CONFIRMATION,,Central African Journal of Medicine,Ndip,"Antibiogram of Klebsiella pneumoniae isolates from Buea, Cameroon",Cameroon,,Buea,,,,,,,,,,,,,,,,,,,,,,,,,,,,,,,,,,,,,,,,,,,,,,,,,,,,,,,,,,,,,,,,,,,,,,,,,,,,,,,,,,
